12:17:01.874424 IP h1.8888 > h2.8888: UDP, length 26
12:17:01.874603 IP h2.8888 > h1.8888: UDP, length 26
12:17:01.874941 IP h1.8888 > h2.8888: UDP, length 35
12:17:01.875014 IP h2.8888 > h1.8888: UDP, length 35
12:17:01.875388 IP h1.8888 > h2.8888: UDP, length 1054
12:17:01.875461 IP h2.8888 > h1.8888: UDP, length 1054
12:17:01.878196 IP h1.8888 > h2.8888: UDP, length 38
12:17:01.878261 IP h2.8888 > h1.8888: UDP, length 38
12:17:01.878335 IP h1.8888 > h2.8888: UDP, length 1057
12:17:01.878393 IP h2.8888 > h1.8888: UDP, length 1057
12:17:01.880306 IP h1.8888 > h2.8888: UDP, length 38
12:17:01.880365 IP h2.8888 > h1.8888: UDP, length 38
12:17:01.880441 IP h1.8888 > h2.8888: UDP, length 1057
12:17:01.880498 IP h2.8888 > h1.8888: UDP, length 1057
12:17:01.882788 IP h1.8888 > h2.8888: UDP, length 38
12:17:01.882922 IP h2.8888 > h1.8888: UDP, length 38
12:17:01.883011 IP h1.8888 > h2.8888: UDP, length 961
12:17:01.883078 IP h2.8888 > h1.8888: UDP, length 961
12:17:01.885048 IP h1.8888 > h2.8888: UDP, length 38
12:17:01.885151 IP h2.8888 > h1.8888: UDP, length 38
12:17:01.885230 IP h1.8888 > h2.8888: UDP, length 30
12:17:01.885286 IP h2.8888 > h1.8888: UDP, length 30
12:17:01.885568 IP h1.8888 > h2.8888: UDP, length 38
12:17:01.885638 IP h2.8888 > h1.8888: UDP, length 38
12:17:06.958967 ARP, Request who-has h1 tell r-net1, length 28
12:17:06.959004 ARP, Request who-has r-net1 tell h1, length 28
12:17:06.959054 ARP, Reply r-net1 is-at 16:03:53:65:64:37 (oui Unknown), length 28
12:17:06.959037 ARP, Reply h1 is-at 92:9a:55:86:8b:51 (oui Unknown), length 28
