13:53:00.831822 IP h1.54939 > h2.5000: UDP, length 121
13:53:01.331535 IP h1.54939 > h2.5000: UDP, length 121
13:53:01.831530 IP h1.54939 > h2.5000: UDP, length 121
13:53:01.931646 IP h2.5000 > h1.54939: UDP, length 122
13:53:01.932801 IP h1.54939 > h2.5000: UDP, length 122
13:53:02.432196 IP h1.54939 > h2.5000: UDP, length 122
13:53:02.532277 IP h2.5000 > h1.54939: UDP, length 138
13:53:02.534621 IP h1.54939 > h2.5000: UDP, length 123
13:53:02.635865 IP h2.5000 > h1.54939: UDP, length 141
13:53:02.637928 IP h1.54939 > h2.5000: UDP, length 72
13:53:03.136417 IP h1.54939 > h2.5000: UDP, length 72
13:53:03.636476 IP h1.54939 > h2.5000: UDP, length 72
13:53:03.736606 IP h2.5000 > h1.54939: UDP, length 68
13:53:03.737559 IP h1.54939 > h2.5000: UDP, length 68
